{"$id":"https://github.com/YEAHDOGS/phoenix/config/usb-config.schema.json","$schema":"https://json-schema.org/draft/2020-12/schema","additionalProperties":false,"description":"Written by the Config GUI on a working machine, read HEADLESS by the Phoenix boot side. Lives at the Ventoy exFAT partition root next to autounattend.xml. OS-agnostic: no OS-specific keys at top level; platform discriminates, platform-specific bits nest under platform_options. Normative rules the JSON Schema cannot express live in docs/CONFIG-SCHEMA.md §6 and are enforced by tools/Validate-UsbConfig.py.","properties":{"backup_target":{"additionalProperties":false,"allOf":[{"if":{"properties":{"kind":{"const":"castle-smb"}}},"then":{"required":["smb_path"]}}],"description":"Where the Backup phase writes the verified disk image.","properties":{"kind":{"description":"direct-usb: image to a second direct-attached USB drive (air-gapped, runbook default). castle-smb: push the image to Castle storage over SMB (PROVISIONAL — share path pending founder answer).","enum":["direct-usb","castle-smb"],"type":"string"},"label_prefix":{"default":"PHOENIX-IMAGE","description":"Prefix for the image folder/file name, e.g. QUARANTINE-INFECTED for suspect machines.","maxLength":64,"type":"string"},"smb_path":{"description":"Castle SMB share for the image, e.g. //castle.lan/images. PROVISIONAL placeholder — founder has not confirmed the share. Required when kind is castle-smb.","maxLength":512,"type":"string"}},"required":["kind"],"type":"object"},"boot_entries":{"additionalProperties":false,"description":"Toggles for the founder's four boot menu entries. The GUI stages ISOs (and Ventoy aliases) only for enabled entries; the boot side ignores disabled ones.","properties":{"analyze":{"default":true,"description":"SystemRescue — inspect without booting the suspect OS.","type":"boolean"},"backup":{"default":true,"description":"Rescuezilla — verified full-disk image before anything destructive.","type":"boolean"},"nuke":{"default":true,"description":"ShredOS/nwipe — disk sanitization. DANGEROUS. Requires target_disks allowlist + image-proof gate (see safety).","type":"boolean"},"reinstall":{"default":true,"description":"Windows install media + autounattend.xml.","type":"boolean"}},"required":["analyze","backup","nuke","reinstall"],"type":"object"},"generated_by":{"description":"Free-text provenance: which GUI/tool wrote this file and when. informational only.","maxLength":256,"type":"string"},"reinstall":{"additionalProperties":false,"description":"Reinstall-phase options (optional).","properties":{"platform":{"default":"windows","description":"OS to install. windows today; linux reserved for a future blade.","enum":["windows","linux"],"type":"string"}},"type":"object"},"safety":{"additionalProperties":false,"description":"Nuke safety flags. Read headless by the boot side; the nuke tool must fail closed if any required flag is missing.","properties":{"abort_countdown_seconds":{"default":5,"description":"Seconds between arming and execution (Ctrl-C aborts). 0 disables (VM tests only).","maximum":60,"minimum":0,"type":"integer"},"allow_skip_image_gate":{"default":false,"description":"Whether the --skip-image-gate escape hatch (typed NUKE WITHOUT BACKUP on a real TTY) exists at all. Default false = the hatch is compiled out of this stick.","type":"boolean"},"require_image_proof":{"default":true,"description":"Runbook invariant 1: nuke refuses without a valid image-proof manifest whose source_serial matches the target. MUST be true whenever boot_entries.nuke is true (enforced, see docs §6).","type":"boolean"}},"required":["require_image_proof"],"type":"object"},"schema_version":{"const":1,"description":"Config schema version. Bump on any breaking change; readers must reject unknown major versions.","type":"integer"},"target_disks":{"description":"ALLOWLIST of disk serials the Nuke phase may target. The boot-side nuke tool refuses any disk whose serial is not listed here (in addition to its runtime serial-typing interlock). Empty list = no disk may be nuked. Serials are copied verbatim from the enumeration table — never hand-typed from memory.","items":{"additionalProperties":false,"properties":{"model":{"description":"Human label for the operator (cosmetic only).","maxLength":128,"type":"string"},"note":{"description":"Why this disk is on the allowlist.","maxLength":256,"type":"string"},"serial":{"description":"Disk serial as reported by lsblk/smartctl (uppercased, whitespace trimmed).","maxLength":64,"minLength":1,"pattern":"^[A-Za-z0-9][A-Za-z0-9 ._-]{0,63}$","type":"string"}},"required":["serial"],"type":"object"},"type":"array","uniqueItems":true},"unattend":{"additionalProperties":false,"description":"Answer-file wiring for the Reinstall phase.","properties":{"answer_file":{"default":"/autounattend.xml","description":"Path on the USB (root-relative) of the answer file consumed by Ventoy auto_install. Generated from this config by the GUI.","pattern":"^/[A-Za-z0-9][A-Za-z0-9._/-]*\\.(xml|XML)$","type":"string"}},"required":["answer_file"],"type":"object"}},"required":["schema_version","boot_entries","target_disks","backup_target","unattend","safety"],"title":"phoenix-config.json — Phoenix USB OS-agnostic config","type":"object"}