{"backup_target": {"kind": "direct-usb"}, "boot_entries": {"analyze": true, "backup": false, "nuke": false, "reinstall": false}, "generated_by": "phoenix backup test fixture", "safety": {"require_image_proof": true}, "schema_version": 1, "target_disks": [], "unattend": {"answer_file": "/autounattend.xml"}}