{"backup_target":{"kind":"direct-usb","label_prefix":"QUARANTINE-INFECTED"},"boot_entries":{"analyze":true,"backup":true,"nuke":true,"reinstall":true},"generated_by":"phoenix gui 0.1.0 @ 2026-09-09T12:00:00Z","reinstall":{"platform":"windows"},"safety":{"abort_countdown_seconds":5,"allow_skip_image_gate":false,"require_image_proof":true},"schema_version":1,"target_disks":[{"model":"WD Blue 1TB (laptop disk)","note":"infected laptop disk - emergency runbook flow","serial":"WD-WMC4N0L12345"}],"unattend":{"answer_file":"/autounattend.xml"}}